,text
992,My old computer needs replacement with a lighter and faster model.
993,My current computer is not keeping up with my expectation so I need a new computer with a high performance-cost ratio.
994,I am taking the laptop to school so it must be light and last long.
995,I need to take a laptop to my internship and I hope it comes with reasonable price and nice look.
996,I am finding myself a light and fast computer.
997,I need an excellent choice for home working and it should be elegant and fast.
998,I am changing my old computer that I want a faster Wifi connection and bootup time.
999,I am becoming a coder and I need a new computer that is sleek and has large storage space.
1000,I am replacing my old computer and I want a lighter and more sturdy one.
1001,I need some recommendations on a fast computer.
1002,I am not sure what computer I should get but I am sure I need one that bootup quickly and display amazingly.
1003,My wife needs a laptop for studying and she wants it to boot up fast and last long with a low cost.
1004,I am switching my old computer to a quicker and lighter one.
1005,I enjoy staying with a high quality brand and now I want a new computer with a good fingerprint sensor and a large amount of storage.
1006,I am taking a laptop that is travel-friendly and lightweight.
1007,"As an experienced Windows user, I am finding a new laptop that is fast, light, sleek and has a good storage capability."
1008,My old computer is not that up-to-date and I need a lighter one with a good keyboard and a good touchpad.
1009,I am buying a slim and lightweight computer for my wife.
1010,I need a new computer that is light and thin with the greatest screen size.
1011,A nice fingerprint scanner should be included in my new computer.
1012,My previous computer does no good to me so I need a new one that is lightweight with fast startup time and nice keyboard design.
1013,Weight is important to me when purchasing a laptop.
1014,I want to have a new computer that is light and fast with a good screen size.
1015,I need a lightweight laptop to bring it around.
1016,I want to purchase a computer that is portable and lightweight.
1017,I am taking the laptop to school and I want it to do fast in typing responsiveness and log in time.
1018,It is time to replace my old computer to a quicker one with a better performance-cost ratio.
1019,I need a great screen to better do my spreadsheets.
1020,A good looking computer with a great price is what I need.
1021,"I want to get a computer that is slim, light, fast and great looking."
1022,I need the specs to be perfect on my computer that means for the screen and the touchpad.
1023,A quick and responsive computer is what I need.
1024,I am using the laptop for small projects and I hope it has an appealing design and litup and easy-to-type keyboard.
1025,I need a fast computer to get my things done quickly.
1026,I want to have a new laptop of office work and I need it to be lightweight and sleek with good build quality.
1027,"I do pay attention to user response on computer and I am finding one that is quick, light and slim."
1028,I am planning to buy a laptop for my son and he wants it to be lightweight and nice looking.
1029,I would need enough ports for charging and for further installment.
1030,My old laptop has a broken screen and I want a more good looking one.
1031,I need a computer to do typical home computer work and it should be light and has a bright screen.
1032,I need a nice backlit keyboard to do work at night.
1033,I treasure every hour of work so I need a fast computer.
1034,"I am buying a new laptop for my husband and he wants it to be lightweight, clear and sharp."
1035,I am finding a new computer with a great price.
1036,I lost my old taplet so I am finding for a new one that show awesome graphics.
1037,I want a compact computer which can do fast browsing.
1038,A light computer is preferable.
1039,I need a computer that is easy to get started.
1040,I am changing to a new computer and I want to come with amazing speakers and comfortable keyboard.
1041,"I need something to bring to work and I hope it would be thin, light and sturdy."
1042,I am replacing my old computer that I want a full sized keyboard with a number pad.
1043,I want a new gaming laptop that play my games well with a good price.
1044,I am buying a new computer for my relative and he needs a good CPU to play games well.
1045,My old computer doesn't work for me anymore and I need a responsive one with high performance-cost ratio.
1046,I need a new computer that is fast and economical.
1047,All I need is a computer that play games well.
1048,I do video editing so the computer should work great with that.
1049,I would use the computer for engineering purposes and it should be good looking and affordable.
1050,I need a computer that run any games well.
1051,I am sensitive to sound so I want the best sound quality on my computer.
1052,I do a lot of typing so the keys should be wonderful.
1053,I am finding a new computer that the keyboard is nice looking and comfortable.
1054,I have a kid in school and I am buying him a new laptop with a chassis texture.
1055,I am finding a new laptop for myself that has a high performance-cost ratio.
1056,I am a student and am looking for a laptop that has a long battery life and a nice screen.
1057,I am finding my first laptop in college and I need it to have excellent visual fidelity and a full keyboard.
1058,My old computer needs replacement and I need one that is sleek and thin.
1059,I am going to buy a new computer and I want it to startup fast with a reasonable price.
1060,I need a new computer for work so everything should be fast including the bootup.
1061,A lightweight computer is what I need.
1062,I want to find a computer that can navigate fast and easily.
1063,I write programmes so I need a computer that is perfect for programming.
1064,I need a computer that immdiately wakes when I use it.
1065,I want a fast computer with a good shell.
1066,I am finding a new computer that have good specs but low price.
1067,I need a fast computer with high performance-cost ratio.
1068,I will need a functional computer.
1069,My old computer just died and I need one that startup smoothly.
1070,I wish on the PSU there would have been a USB port.
1071,I do wish that there was a windows hello enabled camera or a fingerprint reader.
1072,Wish it had another thunderbolt 3 port
1073,I play counter-strike: global offensive and having a laptop with a high refresh rate screen was very important for me.
1074,"I spent a long while looking for that holy trinity of gaming laptops: thin, powerful, and good battery life."
1075,"I wanted something to replace my college laptop (a big, heavy 16"" Dell with an i5 processor) that could handle Overwatch at its high settings while still maintaining its ability to be a professional looking laptop."
1076,"I wanted a new machine that was lighter, had better battery life and was just as powerful for my gaming needs"
1077,Wish it had more memory and a card reader
1078,I would have been fine with a longer space bar.
1079,I wanted a powerhouse that was light and fast.
1080,"I didn't want anything bulky or screaming ""Gaming Laptop"" as I do other things than just gaming like Video Editing, Photo Editing, web design, Virtualization, etc. as my wife calls it, ""Nerd Stuffs""."
1081,I'm a serious gamer so the hardware gotta be top notch
1082,I wish it was a full keyboard with the number pad to the right
1083,Wish it had one more thunderbolt port instead of that mini display port
1084,I do wish it had a little more internal storage
1085,I believe that this PC should at least have 1440p resolution or higher for this price
1086,"I needed a powerful, yet inconspicuous machine that I could take to a meeting and open up on the conference table and not look like I thought I was showing up to a LAN party or eSports arena."
1087,I Wish it came with upgrade options such as 1TB SSD and 32gb ram
1088,"I needed something small for work and travel, but strong enough to do light gaming, preferably heavy gaming."
1089,I wish it did come with at least a 500GB SSD since the space on this will be filled up soon
1090,"I'm a software developer, so I need a fast machine to do my daily work, and gamers notebooks usually fits this requirement."
1091,I was looking for a lightweight laptop that is good for gaming.
1092,I was searching for a laptop that would meet my needs for gaming and have the battery life to take on the go to do school work
1093,It would've been really impressive if the keyboard that a little bit more travel distance.
1094,It could've been really nice if it had double slots for the storage.
1095,it would've been great if it came with the Ethernet USB dongle and the USB type C charger
1096,"I run hard Cuda workloads, so I need a fast machine with an NVIDIA GPU."
1097,I was looking for something powerful but small and thin. This Ultrabook fulfills those characteristics.
1098,I wish the fingerprint scanner were a tad bit more sensitive
1099,"I needed a small durable laptop that can handle lots of artboards, heavy psds, animation, video editing etc"
1100,I think I would have been happier with the bigger screen.
1101,A touch screen would be nice
1102,I wanted a laptop with comparable quality and good looks at a lower price.
1103,I wanted a laptop that could handle the smaller data processing jobs before transferring to a larger super computer.
1104,It would have been ergonomically nice to have had the flexibility to plug in either the Left or Right side for charging.
1105,If AORUS offers two AC adapters to end user will be fantastic!!
1106,I wish there were more ports.
1107,i bet on the horizon there would have been a electrical cord.
1108,the wish with the psu there would have been his usb drive.
1109,i wish on the psu there was never been a radio outlet.
1110,I care on the PSU there would have embody a USB larboard.
1111,Atomic number 53 wish on the PSU in that location would have been a USB port.
1112,I like on the PSU there would have be a USB port.
1113,I wants on the PSU there would approved been a USB seaport.
1114,I wants on the PSU there would have characterized a USB harbours.
1115,I hoping on the PSU there would given disappeared a USB port.
1116,I hope that the PSU has a USB port.
1117,i just wish myself there was a good hello host phone or a fingerprint reader.
1118,nor don'te that there was a personal capture yo camera or a fingerprint reader.
1119,i do wish that there was my windows 9 enabled camera or another fast track.
1120,Ace serve wish that there was a windows hello enabled camera surgery a fingerprint referee.
1121,I do wish that there was a windows hullo enabled camera or a fingerprint reader.
1122,I do bid that there was a windows hullo enabled camera operating theatre a fingerprint reader.
1123,I do likes that there beat a window hello guaranteed camera or a fingerprint reader.
1124,I do likes that there members a window hello enhanced camera or a fingerprint reader.
1125,I do hoping that there nothing a window hello authorizing camera or a fingerprint reader.
1126,I want to have a Windows Hello camera or fingerprint reader.
1127,wish it had another thunderbolt three times
1128,wish it for another level 3 port
1129,then it had won thunderbolt 3 port
1130,Wish well it had another thunderbolt 3 larboard
1131,Bid information technology had another thunderbolt 3 port
1132,Wish well it had another thunderbolt 3 larboard
1133,Wish it considered another thunderbolt 3 seaports
1134,Wish it left another thunderbolt 3 seaports
1135,Wish it behaved another thunderbolt 3 seaports
1136,I hope it has another 霹雳 3 harbor
1137,they study rare - strike : global offensive and having one room with a smart refresh rate screen seems very important for me.
1138,i play counter - logic : lethal force and had a laptop with the high eye rate screen was very important during me.
1139,i play counter - terrorism : global offensive b then a laptop with security monitor refresh on screen was very important from me.
1140,Ane play counter - bang: global offensive and induce a laptop with a high refresh rate screen was really important for pine tree state.
1141,One play counter - strike: ball shaped offensive and having a laptop with a gamy refresh rate screen be very important for me.
1142,Iodin play counter - strike: world wide offensive and having a laptop computer with a high refresh charge per unit screen was real authoritative for me.
1143,I replaying counter - strike: worldwide offensive and leaving a notebook with a high refresh rates screen was extremely essential for me.
1144,I displaying counter - strike: world wide offensive and 'having a notebook with a high refresh rate screen delivered extremely significant for me.
1145,I replaying counter - strike: universal offensive and achieving a notebook with a high refresh rates screen was extremely importance for me.
1146,I play a counter-terrorist elite: a global attacker and a laptop with high refresh rates.
1147,"i spent approximately couple hours looking for that entire box of gaming laptops : thin, powerful, with full battery life."
1148,"i spent a lengthy shot wishing for that odd trinity of gaming experiences : thin, powerful, really good battery pack."
1149,"thomas spent a long while insights into that holy queen of gaming women : thin, neat, and good of life."
1150,"I spend a farseeing while looking for that holy trinity of gaming laptops: thin, powerful, and well battery lifetime."
1151,"I spent a long while look for that holy trinity of game laptops: thin, powerful, and good battery living."
1152,"Iodin spent a foresightful while looking for that holy threesome of gage laptops: thin, knock down, and good assault and battery life."
1153,"I spared a long whereas l for that holy trinity of gaming portables: thin, strong, and good battery lifetime."
1154,"I endorsed a long whilst l for that sacred trinity of gaming desktops: thin, strong, and good battery life."
1155,"I seconded a long whilst overlooking for that sacred trinity of gaming portables: thin, strong, and good battery life."
1156,"I spent a long time when I find the sacred three-in-one integration of the game laptop: thin, powerful, battery life."
1157,"al wanted something to describe my college laptop ( a lightweight, heavy 16 "" dell with ibm i5 system ) it could function just by its high settings while still maintaining its aim to be a professional looking laptop."
1158,"lee wanted them to replace the college phone ( a big, heavy 71 "" dell with one apple processor ) that may handle overwatch at incredibly high settings but still maintaining its ability to be a professional looking laptop."
1159,"i wanted something to replace my current laptop ( a dark, heavy 12 "" unit with an i5 processor ) that could handle overwatch with its record speed while already maintaining its ability to be the professional looking device."
1160,"I wanted something to replace my college laptop (a big, heavy 16 "" Dell with an i5 central processing unit) that could handle Overwatch at its gamy settings while still maintaining its ability to follow a professional take care laptop computer."
1161,"I wanted something to put back my college laptop (a big, heavy 16 "" Dingle with an i5 processor) that could handle Overwatch at it high setting while still keep information technology ability to comprise a professional look laptop."
1162,"I wanted something to interchange my college laptop computer (a expectant, grueling 16 "" Dell with an i5 mainframe) that could palm Overwatch at it high settings while still maintaining its ability to be a professional looking laptop computer."
1163,"I liked anything to replace my college notebook (a great, heavy 16 "" Dell with an i5 processor) that could administering Overwatch at its high settings whereas still implementing its capacity to be a occupational overlooking laptop."
1164,"I preferred anything to represented my college notebook (a great, heavy 16 "" Dell with an i5 processor) that could administering Overwatch at its high beginnings while still insisting its ability to became a professional looking notebook."
1165,"I intended thing to replace my college notebook (a great, heavy 16 "" Dell with an i5 cores) that could administering Overwatch at its high settings whilst still managing its capability to be a professional approximately laptop."
1166,"I want some some university laptop (a large 16-inch Dell, one I5 processor) can handle the corrector on high settings while still maintaining its ability to be a professional laptop."
1167,"i created a special program that was cleaner, had better battery life... was just as powerful than my gaming needs"
1168,"i needed a small machine that was reliable, made better battery life and seemed just as powerful for current gaming needs"
1169,"i wanted a new logo that was lighter, had longer gaming life and was just as good for online gaming before"
1170,"Iodin wanted a new machine that was lighter, had better bombardment aliveness and live simply as powerful for my gaming needs"
1171,"I wanted a new machine that was lighter, had better electric battery life and was just equally powerful for my gambling want"
1172,"I wanted a new machine that was lighter, have better barrage aliveness and was scarce every bit powerful for my gaming needs"
1173,"I intended a new machine that participated lighter, left less battery lifetime and was just as powerful for my gambling needs"
1174,"I warranted a new machinery that enabled lighter, had enhancement battery lifetime and participated just as powerful for my gaming needs"
1175,"I wanted a new machinery that was brighter, ha improvement battery lifetime and was just as powerful for my game needs"
1176,"I want a lighter new machine with a lighter, there is a better battery life, for my game demand and powerful machine"
1177,wish it had more clothes and better card reader
1178,wish it a more memory and a card of
1179,wish it brought more memory and a hand reader
1180,Wish information technology had more memory and a notice reader
1181,Wish information technology had more memory and a card reviewer
1182,Wish it had to a greater extent memory and a card reader
1183,Wish it gave more memory and a cardholders reader
1184,Wish it achieved more memory and a cardholders reader
1185,Wish it very more memory and a cardholders reader
1186,I hope it has more memory and card readers.
1187,i would just done fine with a tiny space bar.
1188,i would ve remembered fine with his longer space bar.
1189,i would only thought fine with a longer space actually.
1190,I would have be ok with a longer space bar.
1191,I would have represent o.k. with a longer space bar.
1192,I would have been hunky dory with a longer outer space bar.
1193,I would approved removed fine with a long space bar.
1194,I would characterized described fine with a long space bar.
1195,I would achieved facilitated fine with a long space bar.
1196,I will have a longer space bar.
1197,i wanted a powerhouse whom played light and clean.
1198,i sensed a powerhouse that was light enough secure.
1199,i pictured the powerhouse that was powerful and fast.
1200,I wanted a powerhouse that was easy and flying.
1201,One desire a powerhouse that was light and fast.
1202,I wanted a ball of fire that was lite and loyal.
1203,I preferred a powerhouse that belonged lightweight and fast.
1204,I intended a powerhouse that characterized slight and fast.
1205,I wait a powerhouse that correspond slight and fast.
1206,I'd like a light power.
1207,"i didn'the work anything bulky or called "" gaming movies "" as i do other jobs than just like doing video editing, photo processing, web design, virtualization, x. as my wife calls it, "" gaming stuffs ""."
1208,"i didn't want myself crashing or screaming "" gaming laptop "" as i do other things in other software like video editing, photo editing, graphic design, virtualization, etc. as my wife terms them, "" real time ""."
1209,"i did't want anything bulky started screaming "" gaming laptop "" while kids do other things are just coding like video editing, photo editing, web design, marketing, etc. so my wife calls this, "" other stuffs ""."
1210,"One didn ' t want anything bulky or scream "" Gaming Laptop "" as 1 do other things than but back like Video Editing, Photograph Redaction, web design, Virtualization, etc. as my married woman calls it, "" Nerd Stuffs ""."
1211,"Single didn ' thyroxin desire anything bulky or screaming "" Gambling Laptop "" as I do other things than just game like Video Editing, Exposure Editing, web design, Virtualization, etc. as my wife calls it, "" Nerd Stuff ""."
1212,"I didn ' t want anything bulky or screaming "" Gaming Laptop computer "" as I arrange other things than simply bet on like Video Editing, Photo Editing, web design, Virtualization, etc. as my married woman calls it, "" Nerd Stuff and nonsense ""."
1213,"I didn ' t likes everything bulky or screaming "" Gaming Laptop "" as I do other insights than just gaming like Video Editing, Photo Editing, website designed, Virtualization, etc. as my wife appeals it, "" Nerd Stuffs ""."
1214,"I didn ' t likes something bulky or screaming "" Gaming Laptop "" as I do other situations than just gaming like Video Editing, Photo Editing, website designing, Virtualization, etc. as my wife recommendation it, "" Nerd Stuffs ""."
1215,"I didn ' t likes everything bulky or screaming "" Gaming Laptop "" as I do other characteristics than just gaming like Video Editing, Photo Editing, website designing, Virtualization, etc. as my wife recommendations it, "" Nerd Stuffs ""."
1216,"I don't want any cumbersome or scream ""Game Laptop"" because I did the game in addition to video editing, photo editing, web design, virtualization, etc., because my wife called ""nerd""."
1217,i'm a serious gamer hoping the hardware would get top notch
1218,1'm a serious gamer so any hardware could be top notch
1219,actually'm a serious gamer and the hardware gotta work top notch
1220,I ' m a serious gamer so the hardware gotta be top snick
1221,I ' m a serious gamer so the ironware gotta be top notch
1222,I ' m a serious gamer so the hardware gotta personify top notch
1223,I ' m a grave gamer so the hardware gotta became top notch
1224,I ' m a gravest gamer so the hardware gotta became top notch
1225,I ' m a grave gamer so the hardware gotta supported top notch
1226,"I am a serious game player, so the hardware must be the top trap."
1227,i wish it was your full keyboard with the number pad pressed cover space
1228,even wish it was to full keyboard with this number pad to my right
1229,i wish a was a full keyboard with the number three for their right
1230,Atomic number 53 wish it was a total keyboard with the number pad to the right
1231,I wish it be a full keyboard with the figure pad to the right
1232,1 wish it was a full keyboard with the number pad to the right
1233,I likes it was a complete keypad with the numbers pad to the right
1234,I wants it ben a full keypad with the numbers pad to the right
1235,I wants it belonged a fully fledged keypad with the number pad to the right
1236,"I hope it is a complete keyboard, the number pad on the right."
1237,wish it had one more little virus instead of that damn linux port
1238,wish he had one more handheld device instead of that mini commodore port
1239,wish had had that dedicated thunderbolt port instead over that mini display port
1240,Care it had one more than thunderbolt port instead of that miniskirt display port
1241,Wish it have one more than thunderbolt port or else of that mini display port
1242,Wish it had one more thunderbolt port alternatively of that mini video display port
1243,Wish it behaved one more thunderbolt seaport instead of that mini display seaports
1244,Wish it behaved one more thunderbolt seaports instead of that mini display seaport
1245,Wish it had one more thunderbolt seaports rather of that mini displaying port
1246,I hope it has a thunderstorm port instead of that mini display port.
1247,me do wish it looked a bit more internal storage
1248,i do suppose it had a considerably easier internal storage
1249,and do wish it had a little better extra storage
1250,Iodin do wish it had a little to a greater extent internal memory board
1251,One serve wish it had a little more interior storage
1252,One do wish it had a little to a greater extent internal storage
1253,I do hoping it removed a little more internal stores
1254,I do hoping it involved a little more internal storerooms
1255,I do likes it approved a little more internal warehouses
1256,I hope it has a little internal storage
1257,i believe that this tv should in present have 1440p resolution or something given this price
1258,others believe now this work may at least have moderate resolution or higher for this price
1259,i believe that one facility should at least have 1440p instead of higher for this because
1260,I believe that this personal computer should at least have 1440p resolution or higher for this price
1261,Unity believe that this PC should at least have 1440p resolution or high for this price
1262,I believe that this PC should at least have 1440p resolution or high for this cost
1263,I are that this PC should at littlest have 1440p determinations or higher for this pricing
1264,I believe that this PC should at largest approved 1440p determinations or higher for this pricing
1265,I thought that this PC should at littlest given 1440p resolution or higher for this pricing
1266,I think this PC should have at least 1440 resolution or higher prices.
1267,"us needed a powerful, albeit inconspicuous machine that someone could take to this meeting with heat up on the conference table and not look like i thought that was showing up through a lan gaming or esports competition."
